{
  "schema_version": 1,
  "ticker": "KO",
  "exchange": "NYSE",
  "company_name": "The Coca-Cola Company",
  "reporting_locale": "tr-TR",
  "classification": {
    "source": "SEC",
    "official_sector": "Manufacturing",
    "official_industry": "Beverages",
    "official_subindustry": null,
    "actual_activity": "Nonalcoholic beverage concentrates and finished beverages",
    "classification_date": "2026-08-03"
  },
  "pipeline": {"company_type": "standard_corporate", "sector_module": "generic"},
  "sources": {"identity_source": "SEC submissions", "classification_source": "SEC"},
  "version": 1,
  "is_active": true
}
