{"schema_version":1,"ticker":"CPB","exchange":"NASDAQ","company_name":"The Campbell's Company","reporting_locale":"tr-TR","classification":{"source":"SEC","official_sector":"Manufacturing","official_industry":"Food products","official_subindustry":null,"actual_activity":"Meals, beverages, snacks and packaged foods","classification_date":"2026-08-04"},"pipeline":{"company_type":"standard_corporate","sector_module":"generic"},"sources":{"identity_source":"SEC submissions","classification_source":"SEC"},"version":1,"is_active":true}
