{"schema_version":1,"ticker":"GIS","exchange":"NYSE","company_name":"General Mills, Inc.","reporting_locale":"tr-TR","classification":{"source":"SEC","official_sector":"Manufacturing","official_industry":"Food products","official_subindustry":null,"actual_activity":"Branded consumer foods","classification_date":"2026-08-03"},"pipeline":{"company_type":"standard_corporate","sector_module":"generic"},"sources":{"identity_source":"SEC submissions","classification_source":"SEC"},"version":1,"is_active":true}
