{
 "schema_version": 1,
 "ticker": "ABBV",
 "exchange": "NYSE",
 "company_name": "AbbVie Inc.",
 "reporting_locale": "tr-TR",
 "classification": {
  "source": "SEC",
  "official_sector": "Life sciences",
  "official_industry": "LargePharma",
  "official_subindustry": null,
  "actual_activity": "LargePharma",
  "classification_date": "2026-08-05"
 },
 "pipeline": {
  "company_type": "standard_corporate",
  "sector_module": "generic"
 },
 "sources": {
  "identity_source": "SEC submissions",
  "classification_source": "SEC"
 },
 "version": 1,
 "is_active": true
}
