{"schema_version":1,"ticker":"DG","exchange":"NYSE","company_name":"Dollar General Corporation","reporting_locale":"tr-TR","classification":{"source":"SEC","official_sector":"Retail trade","official_industry":"Discount retail","official_subindustry":null,"actual_activity":"Small-box discount retail","classification_date":"2026-08-04"},"pipeline":{"company_type":"standard_corporate","sector_module":"generic"},"sources":{"identity_source":"SEC submissions","classification_source":"SEC"},"version":1,"is_active":true}
