{
  "schema_version": 1,
  "ticker": "AMGN",
  "exchange": "NASDAQ",
  "company_name": "Amgen Inc.",
  "reporting_locale": "tr-TR",
  "classification": {
    "source": "SEC",
    "official_sector": "Health Care",
    "official_industry": "Biotechnology",
    "official_subindustry": null,
    "actual_activity": "Biotechnology and Biopharmaceuticals",
    "classification_date": "2026-08-12"
  },
  "pipeline": {"company_type": "standard_corporate", "sector_module": "generic"},
  "sources": {"identity_source": "SEC submissions", "classification_source": "SEC"},
  "version": 1,
  "is_active": true
}
