{"schema_version":1,"ticker":"CHD","exchange":"NYSE","company_name":"Church & Dwight Co., Inc.","reporting_locale":"tr-TR","classification":{"source":"SEC","official_sector":"Manufacturing","official_industry":"Consumer products","official_subindustry":null,"actual_activity":"Household and personal care consumer products","classification_date":"2026-08-04"},"pipeline":{"company_type":"standard_corporate","sector_module":"generic"},"sources":{"identity_source":"SEC submissions","classification_source":"SEC"},"version":1,"is_active":true}
